{
  "id": "water-hazards",
  "name": "campingActivities.water-hazards.name",
  "journalUuid": "Compendium.pf2e-kingmaker-tools.kingmaker-tools-journals.JournalEntry.uSTTCqRYCWj7a38F.JournalEntryPage.HGcwmsfjVqfLeYhu",
  "isLocked": true,
  "isSecret": false,
  "isHomebrew": false,
  "skills": [],
  "requiredCompanion": "Kalikke",
  "oncePerSession": true
}
