{
  "id": "enhance-weapons",
  "name": "campingActivities.enhance-weapons.name",
  "journalUuid": "Compendium.pf2e-kingmaker-tools.kingmaker-tools-journals.JournalEntry.uSTTCqRYCWj7a38F.JournalEntryPage.2Dn89HrY7gyvQiOH",
  "isLocked": true,
  "isSecret": false,
  "isHomebrew": false,
  "skills": [],
  "requiredCompanion": "Amiri",
  "oncePerSession": true
}
