{
  "id": "learn-from-a-companion",
  "name": "campingActivities.learn-from-a-companion.name",
  "journalUuid": "Compendium.pf2e-kingmaker-tools.kingmaker-tools-journals.JournalEntry.uSTTCqRYCWj7a38F.JournalEntryPage.MyeB2g0yDwEsqfI9",
  "isLocked": true,
  "isSecret": false,
  "isHomebrew": false,
  "skills": [
    {
      "name": "perception",
      "dcType": "static",
      "proficiency": "untrained",
      "dc": 20
    }
  ],
  "criticalSuccess": {
    "message": "campingActivities.learn-from-a-companion.criticalSuccess.message"
  },
  "success": {
    "message": "campingActivities.learn-from-a-companion.success.message"
  },
  "failure": {
    "message": "campingActivities.learn-from-a-companion.failure.message"
  },
  "criticalFailure": {
    "message": "campingActivities.learn-from-a-companion.criticalFailure.message"
  },
  "oncePerSession": true
}
