{
  "id": "organize-watch",
  "name": "campingActivities.organize-watch.name",
  "journalUuid": "Compendium.pf2e-kingmaker-tools.kingmaker-tools-journals.JournalEntry.uSTTCqRYCWj7a38F.JournalEntryPage.wgyPZBRgPjTeK0Ch",
  "isLocked": false,
  "isSecret": false,
  "isHomebrew": false,
  "skills": [
    {
      "name": "perception",
      "proficiency": "expert",
      "dcType": "zone"
    }
  ],
  "criticalSuccess": {
    "message": "campingActivities.organize-watch.criticalSuccess.message",
    "effectUuids": [
      {
        "uuid": "Compendium.pf2e-kingmaker-tools.kingmaker-tools-camping-effects.Item.010XlkzzjX38BHsO"
      }
    ]
  },
  "success": {
    "message": "campingActivities.organize-watch.success.message",
    "effectUuids": [
      {
        "uuid": "Compendium.pf2e-kingmaker-tools.kingmaker-tools-camping-effects.Item.MOXWga7l8dsypUPy"
      }
    ]
  },
  "failure": {
    "message": "campingActivities.organize-watch.failure.message"
  },
  "criticalFailure": {
    "message": "campingActivities.organize-watch.criticalFailure.message",
    "checkRandomEncounter": true
  },
  "oncePerSession": true
}
