{
  "id": "camouflage-campsite",
  "name": "campingActivities.camouflage-campsite.name",
  "journalUuid": "Compendium.pf2e-kingmaker-tools.kingmaker-tools-journals.JournalEntry.uSTTCqRYCWj7a38F.JournalEntryPage.mlLCjokti3RXAlUP",
  "isLocked": false,
  "isSecret": true,
  "isHomebrew": false,
  "skills": [
    {
      "name": "stealth",
      "proficiency": "trained",
      "dcType": "zone"
    }
  ],
  "criticalSuccess": {
    "message": "campingActivities.camouflage-campsite.criticalSuccess.message",
    "modifyRandomEncounterDc": {
      "day": 2,
      "night": 2
    }
  },
  "success": {
    "message": "campingActivities.camouflage-campsite.success.message",
    "modifyRandomEncounterDc": {
      "day": 1,
      "night": 1
    }
  },
  "criticalFailure": {
    "message": "campingActivities.camouflage-campsite.criticalFailure.message",
    "modifyRandomEncounterDc": {
      "day": -2,
      "night": -2
    }
  },
  "oncePerSession": true
}
