{
  "id": "enhance-campfire",
  "name": "campingActivities.enhance-campfire.name",
  "journalUuid": "Compendium.pf2e-kingmaker-tools.kingmaker-tools-journals.JournalEntry.uSTTCqRYCWj7a38F.JournalEntryPage.ytyW9F39m7xf0gx5",
  "isLocked": true,
  "isSecret": false,
  "isHomebrew": false,
  "skills": [],
  "effectUuids": [
    {
      "uuid": "Compendium.pf2e-kingmaker-tools.kingmaker-tools-camping-effects.Item.NFPQHxvpJd2vsKMe"
    }
  ],
  "requiredCompanion": "Kanerah",
  "oncePerSession": true
}
