{
  "id": "blend-into-the-night",
  "name": "campingActivities.blend-into-the-night.name",
  "journalUuid": "Compendium.pf2e-kingmaker-tools.kingmaker-tools-journals.JournalEntry.uSTTCqRYCWj7a38F.JournalEntryPage.jz1FI7zSoPLR8iBL",
  "isLocked": true,
  "isSecret": false,
  "isHomebrew": false,
  "skills": [],
  "modifyRandomEncounterDc": {
    "day": 0,
    "night": 2
  },
  "requiredCompanion": "Harrim",
  "oncePerSession": true
}
