{
  "id": "prepare-campsite",
  "name": "campingActivities.prepare-campsite.name",
  "isHomebrew": false,
  "skills": [
    {
      "name": "survival",
      "proficiency": "untrained",
      "dcType": "zone"
    }
  ],
  "isSecret": false,
  "journalUuid": "Compendium.pf2e-kingmaker-tools.kingmaker-tools-journals.JournalEntry.uSTTCqRYCWj7a38F.JournalEntryPage.Iuen7iSvZAlnAJFB",
  "isLocked": false,
  "criticalSuccess": {
    "message": "campingActivities.prepare-campsite.criticalSuccess.message",
    "modifyRandomEncounterDc": {
      "day": 2,
      "night": 2
    }
  },
  "success": {
    "message": "campingActivities.prepare-campsite.success.message"
  },
  "failure": {
    "message": "campingActivities.prepare-campsite.failure.message",
    "effectUuids": [
      {
        "uuid": "Compendium.pf2e-kingmaker-tools.kingmaker-tools-camping-effects.Item.X1OvR5j1cAXZ4Lbp"
      }
    ]
  },
  "criticalFailure": {
    "message": "campingActivities.prepare-campsite.criticalFailure.message",
    "checkRandomEncounter": true
  },
  "oncePerSession": true
}
