{
  "id": "maintain-armor",
  "name": "campingActivities.maintain-armor.name",
  "journalUuid": "Compendium.pf2e-kingmaker-tools.kingmaker-tools-journals.JournalEntry.uSTTCqRYCWj7a38F.JournalEntryPage.zUaeA8Ud9dv3hhnc",
  "isLocked": true,
  "isSecret": false,
  "isHomebrew": false,
  "skills": [],
  "requiredCompanion": "Valerie",
  "oncePerSession": true
}
