{
  "id": "wilderness-survival",
  "name": "campingActivities.wilderness-survival.name",
  "journalUuid": "Compendium.pf2e-kingmaker-tools.kingmaker-tools-journals.JournalEntry.uSTTCqRYCWj7a38F.JournalEntryPage.8PNH77YHVkw9KoAv",
  "isLocked": true,
  "isSecret": false,
  "isHomebrew": false,
  "skills": [],
  "effectUuids": [
    {
      "uuid": "Compendium.pf2e-kingmaker-tools.kingmaker-tools-camping-effects.Item.v9i9W49PeJ9NkfXX"
    }
  ],
  "requiredCompanion": "Ekundayo",
  "oncePerSession": true
}
