{
  "id": "set-alarms",
  "name": "campingActivities.set-alarms.name",
  "journalUuid": "Compendium.pf2e-kingmaker-tools.kingmaker-tools-journals.JournalEntry.uSTTCqRYCWj7a38F.JournalEntryPage.vWSQmYLKlrk3rLDE",
  "isLocked": true,
  "isSecret": false,
  "isHomebrew": false,
  "skills": [],
  "effectUuids": [
    {
      "uuid": "Compendium.pf2e-kingmaker-tools.kingmaker-tools-camping-effects.Item.ptjs54eoEX8EAQNq"
    }
  ],
  "requiredCompanion": "Octavia",
  "oncePerSession": true
}
