{
  "id": "camp-management",
  "name": "campingActivities.camp-management.name",
  "journalUuid": "Compendium.pf2e-kingmaker-tools.kingmaker-tools-journals.JournalEntry.uSTTCqRYCWj7a38F.JournalEntryPage.JRScwsFTXTpTwWYA",
  "isLocked": true,
  "isSecret": false,
  "isHomebrew": false,
  "skills": [
    {
      "name": "survival",
      "proficiency": "untrained",
      "dcType": "zone"
    }
  ],
  "criticalSuccess": {
    "message": "campingActivities.camp-management.criticalSuccess.message"
  },
  "success": {
    "message": "campingActivities.camp-management.success.message"
  },
  "criticalFailure": {
    "message": "campingActivities.camp-management.criticalFailure.message",
    "effectUuids": [
      {
        "uuid": "Compendium.pf2e-kingmaker-tools.kingmaker-tools-camping-effects.Item.vpH13xgAqX4zsU6o"
      }
    ]
  },
  "requiredCompanion": "Jubilost",
  "oncePerSession": true
}
