{
  "id": "hunt-and-gather",
  "name": "campingActivities.hunt-and-gather.name",
  "journalUuid": "Compendium.pf2e-kingmaker-tools.kingmaker-tools-journals.JournalEntry.uSTTCqRYCWj7a38F.JournalEntryPage.RujdVNvLpoQBBdVV",
  "isLocked": false,
  "isSecret": false,
  "isHomebrew": false,
  "skills": [
    {
      "name": "survival",
      "proficiency": "trained",
      "dcType": "zone",
      "required": true
    },
    {
      "name": "hunting",
      "proficiency": "trained",
      "dcType": "zone"
    }
  ],
  "criticalSuccess": {
    "message": "campingActivities.hunt-and-gather.criticalSuccess.message"
  },
  "success": {
    "message": "campingActivities.hunt-and-gather.success.message"
  },
  "failure": {
    "message": "campingActivities.hunt-and-gather.failure.message"
  },
  "criticalFailure": {
    "message": "campingActivities.hunt-and-gather.criticalFailure.message",
    "checkRandomEncounter": true
  },
  "oncePerSession": true
}
