{
  "id": "cook-meal",
  "name": "campingActivities.cook-meal.name",
  "journalUuid": "Compendium.pf2e-kingmaker-tools.kingmaker-tools-journals.JournalEntry.uSTTCqRYCWj7a38F.JournalEntryPage.S72BNBTfKfkCjriU",
  "isLocked": false,
  "isSecret": false,
  "isHomebrew": false,
  "skills": [],
  "criticalSuccess": {
    "message": "campingActivities.cook-meal.criticalSuccess.message"
  },
  "success": {
    "message": "campingActivities.cook-meal.success.message"
  },
  "failure": {
    "message": "campingActivities.cook-meal.failure.message"
  },
  "criticalFailure": {
    "message": "campingActivities.cook-meal.criticalFailure.message"
  },
  "oncePerSession": false
}
