{
  "id": "bolster-confidence",
  "name": "campingActivities.bolster-confidence.name",
  "journalUuid": "Compendium.pf2e-kingmaker-tools.kingmaker-tools-journals.JournalEntry.uSTTCqRYCWj7a38F.JournalEntryPage.pxHYFLK7VYGppCzS",
  "isLocked": true,
  "isSecret": false,
  "skills": [],
  "isHomebrew": false,
  "effectUuids": [
    {
      "uuid": "Compendium.pf2e-kingmaker-tools.kingmaker-tools-camping-effects.Item.mAEvnTqFuLIASQLB"
    }
  ],
  "requiredCompanion": "Linzi",
  "oncePerSession": true
}
