{
  "id": "tell-campfire-story",
  "name": "campingActivities.tell-campfire-story.name",
  "journalUuid": "Compendium.pf2e-kingmaker-tools.kingmaker-tools-journals.JournalEntry.uSTTCqRYCWj7a38F.JournalEntryPage.XaKD1oGTAgZUjlQ5",
  "isLocked": false,
  "isSecret": false,
  "skills": [
    {
      "name": "performance",
      "dcType": "actorLevel",
      "proficiency": "untrained"
    }
  ],
  "isHomebrew": false,
  "criticalSuccess": {
    "message": "campingActivities.tell-campfire-story.criticalSuccess.message",
    "effectUuids": [
      {
        "uuid": "Compendium.pf2e-kingmaker-tools.kingmaker-tools-camping-effects.Item.2vdskbqd0VrWKR9Y",
        "target": "allies"
      }
    ]
  },
  "success": {
    "message": "campingActivities.tell-campfire-story.success.message",
    "effectUuids": [
      {
        "uuid": "Compendium.pf2e-kingmaker-tools.kingmaker-tools-camping-effects.Item.wT2NzrfgmWmCMRtv",
        "target": "allies"
      }
    ]
  },
  "failure": {
    "message": "campingActivities.tell-campfire-story.failure.message"
  },
  "criticalFailure": {
    "message": "campingActivities.tell-campfire-story.criticalFailure.message",
    "effectUuids": [
      {
        "uuid": "Compendium.pf2e-kingmaker-tools.kingmaker-tools-camping-effects.Item.y5Jqw40SWNOgcxvC",
        "target": "allies"
      }
    ]
  },
  "oncePerSession": true
}
